{
  "design": "two_stage",
  "rules": {
    "name": "generic-180",
    "confidence": "educational",
    "owner": "analog design engineer",
    "approval": "example only; the analog design owner must approve any production rule pack"
  },
  "width_convention": "per_finger",
  "devices": [
    {
      "name": "M1",
      "role": "input_pair",
      "role_source": "explicit",
      "group": "IN",
      "match": "DP",
      "layout": "common_centroid",
      "kind": "mos",
      "mos_type": "nmos",
      "w_um": 5.0,
      "l_um": 0.5,
      "nf": 4,
      "m": 1,
      "total_w_um": 20.0,
      "w_layout_um": 5.28,
      "h_layout_um": 5.5,
      "area_core_um2": 29.04,
      "area_ring_um2": 19.81,
      "area_routing_um2": 8.79,
      "area_total_um2": 57.64,
      "c_pf": 0.0,
      "notes": [
        "critical device: guard ring included in estimate",
        "w treated as per-finger width"
      ]
    },
    {
      "name": "M2",
      "role": "input_pair",
      "role_source": "explicit",
      "group": "IN",
      "match": "DP",
      "layout": "common_centroid",
      "kind": "mos",
      "mos_type": "nmos",
      "w_um": 5.0,
      "l_um": 0.5,
      "nf": 4,
      "m": 1,
      "total_w_um": 20.0,
      "w_layout_um": 5.28,
      "h_layout_um": 5.5,
      "area_core_um2": 29.04,
      "area_ring_um2": 19.81,
      "area_routing_um2": 8.79,
      "area_total_um2": 57.64,
      "c_pf": 0.0,
      "notes": [
        "critical device: guard ring included in estimate",
        "w treated as per-finger width"
      ]
    },
    {
      "name": "M3",
      "role": "current_mirror",
      "role_source": "explicit",
      "group": "LOAD",
      "match": "CM",
      "layout": "interdigitated",
      "kind": "mos",
      "mos_type": "pmos",
      "w_um": 5.0,
      "l_um": 1.0,
      "nf": 2,
      "m": 1,
      "total_w_um": 10.0,
      "w_layout_um": 3.64,
      "h_layout_um": 5.5,
      "area_core_um2": 20.02,
      "area_ring_um2": 17.18,
      "area_routing_um2": 6.7,
      "area_total_um2": 43.9,
      "c_pf": 0.0,
      "notes": [
        "critical device: guard ring included in estimate",
        "w treated as per-finger width"
      ]
    },
    {
      "name": "M4",
      "role": "current_mirror",
      "role_source": "explicit",
      "group": "LOAD",
      "match": "CM",
      "layout": "interdigitated",
      "kind": "mos",
      "mos_type": "pmos",
      "w_um": 5.0,
      "l_um": 1.0,
      "nf": 2,
      "m": 1,
      "total_w_um": 10.0,
      "w_layout_um": 3.64,
      "h_layout_um": 5.5,
      "area_core_um2": 20.02,
      "area_ring_um2": 17.18,
      "area_routing_um2": 6.7,
      "area_total_um2": 43.9,
      "c_pf": 0.0,
      "notes": [
        "critical device: guard ring included in estimate",
        "w treated as per-finger width"
      ]
    },
    {
      "name": "M5",
      "role": "tail_current",
      "role_source": "explicit",
      "group": "BIAS",
      "match": "TAIL",
      "layout": "common_centroid",
      "kind": "mos",
      "mos_type": "nmos",
      "w_um": 10.0,
      "l_um": 1.0,
      "nf": 4,
      "m": 1,
      "total_w_um": 40.0,
      "w_layout_um": 7.28,
      "h_layout_um": 10.5,
      "area_core_um2": 76.44,
      "area_ring_um2": 31.01,
      "area_routing_um2": 19.34,
      "area_total_um2": 126.79,
      "c_pf": 0.0,
      "notes": [
        "critical device: guard ring included in estimate",
        "w treated as per-finger width"
      ]
    },
    {
      "name": "M6",
      "role": "output_stage",
      "role_source": "explicit",
      "group": "OUT",
      "match": null,
      "layout": "interdigitated",
      "kind": "mos",
      "mos_type": "nmos",
      "w_um": 10.0,
      "l_um": 1.0,
      "nf": 4,
      "m": 1,
      "total_w_um": 40.0,
      "w_layout_um": 7.28,
      "h_layout_um": 10.5,
      "area_core_um2": 76.44,
      "area_ring_um2": 0.0,
      "area_routing_um2": 13.76,
      "area_total_um2": 90.2,
      "c_pf": 0.0,
      "notes": [
        "w treated as per-finger width"
      ]
    },
    {
      "name": "M7",
      "role": "output_stage",
      "role_source": "explicit",
      "group": "OUT",
      "match": null,
      "layout": "interdigitated",
      "kind": "mos",
      "mos_type": "pmos",
      "w_um": 10.0,
      "l_um": 1.0,
      "nf": 8,
      "m": 1,
      "total_w_um": 80.0,
      "w_layout_um": 14.56,
      "h_layout_um": 10.5,
      "area_core_um2": 152.88,
      "area_ring_um2": 0.0,
      "area_routing_um2": 27.52,
      "area_total_um2": 180.4,
      "c_pf": 0.0,
      "notes": [
        "w treated as per-finger width"
      ]
    },
    {
      "name": "M8",
      "role": "enable_switch",
      "role_source": "explicit",
      "group": "EN",
      "match": null,
      "layout": "minimal",
      "kind": "mos",
      "mos_type": "nmos",
      "w_um": 2.0,
      "l_um": 0.5,
      "nf": 1,
      "m": 1,
      "total_w_um": 2.0,
      "w_layout_um": 1.32,
      "h_layout_um": 2.5,
      "area_core_um2": 3.3,
      "area_ring_um2": 0.0,
      "area_routing_um2": 0.59,
      "area_total_um2": 3.89,
      "c_pf": 0.0,
      "notes": [
        "w treated as per-finger width"
      ]
    },
    {
      "name": "M9",
      "role": "adj_switch",
      "role_source": "explicit",
      "group": "ADJ",
      "match": null,
      "layout": "minimal",
      "kind": "mos",
      "mos_type": "nmos",
      "w_um": 1.0,
      "l_um": 0.5,
      "nf": 1,
      "m": 1,
      "total_w_um": 1.0,
      "w_layout_um": 1.32,
      "h_layout_um": 1.5,
      "area_core_um2": 1.98,
      "area_ring_um2": 0.0,
      "area_routing_um2": 0.36,
      "area_total_um2": 2.34,
      "c_pf": 0.0,
      "notes": [
        "w treated as per-finger width"
      ]
    },
    {
      "name": "C1",
      "role": "compensation",
      "role_source": "explicit",
      "group": "COMP",
      "match": null,
      "layout": null,
      "kind": "cap",
      "mos_type": null,
      "w_um": 0.0,
      "l_um": 0.0,
      "nf": 1,
      "m": 1,
      "total_w_um": 0.0,
      "w_layout_um": 38.73,
      "h_layout_um": 25.82,
      "area_core_um2": 1000.0,
      "area_ring_um2": 0.0,
      "area_routing_um2": 100.0,
      "area_total_um2": 1100.0,
      "c_pf": 1.5,
      "notes": [
        "compensation cap; keep away from noisy nodes"
      ]
    }
  ],
  "groups": [
    {
      "key": "COMP",
      "role": "compensation",
      "match": null,
      "devices": [
        "C1"
      ],
      "device_count": 1,
      "area_no_dummy_um2": 1100.0,
      "dummy_count": 0,
      "existing_dummy_count": 0,
      "area_dummy_um2": 0.0,
      "overhead_fraction": 0.0,
      "area_with_dummy_um2": 1100.0,
      "area_low_um2": 880.0,
      "area_high_um2": 1485.0
    },
    {
      "key": "TAIL",
      "role": "tail_current",
      "match": "TAIL",
      "devices": [
        "M5"
      ],
      "device_count": 1,
      "area_no_dummy_um2": 126.79,
      "dummy_count": 2,
      "existing_dummy_count": 0,
      "area_dummy_um2": 253.58,
      "overhead_fraction": 0.12,
      "area_with_dummy_um2": 426.01,
      "area_low_um2": 340.81,
      "area_high_um2": 575.11
    },
    {
      "key": "OUT",
      "role": "output_stage",
      "match": null,
      "devices": [
        "M6",
        "M7"
      ],
      "device_count": 2,
      "area_no_dummy_um2": 270.6,
      "dummy_count": 0,
      "existing_dummy_count": 0,
      "area_dummy_um2": 0.0,
      "overhead_fraction": 0.0,
      "area_with_dummy_um2": 270.6,
      "area_low_um2": 216.48,
      "area_high_um2": 365.31
    },
    {
      "key": "DP",
      "role": "input_pair",
      "match": "DP",
      "devices": [
        "M1",
        "M2"
      ],
      "device_count": 2,
      "area_no_dummy_um2": 115.28,
      "dummy_count": 2,
      "existing_dummy_count": 0,
      "area_dummy_um2": 115.28,
      "overhead_fraction": 0.12,
      "area_with_dummy_um2": 258.23,
      "area_low_um2": 206.58,
      "area_high_um2": 348.61
    },
    {
      "key": "CM",
      "role": "current_mirror",
      "match": "CM",
      "devices": [
        "M3",
        "M4"
      ],
      "device_count": 2,
      "area_no_dummy_um2": 87.8,
      "dummy_count": 2,
      "existing_dummy_count": 0,
      "area_dummy_um2": 87.8,
      "overhead_fraction": 0.06,
      "area_with_dummy_um2": 186.14,
      "area_low_um2": 148.91,
      "area_high_um2": 251.29
    },
    {
      "key": "EN",
      "role": "enable_switch",
      "match": null,
      "devices": [
        "M8"
      ],
      "device_count": 1,
      "area_no_dummy_um2": 3.89,
      "dummy_count": 0,
      "existing_dummy_count": 0,
      "area_dummy_um2": 0.0,
      "overhead_fraction": 0.0,
      "area_with_dummy_um2": 3.89,
      "area_low_um2": 3.12,
      "area_high_um2": 5.26
    },
    {
      "key": "ADJ",
      "role": "adj_switch",
      "match": null,
      "devices": [
        "M9"
      ],
      "device_count": 1,
      "area_no_dummy_um2": 2.34,
      "dummy_count": 0,
      "existing_dummy_count": 0,
      "area_dummy_um2": 0.0,
      "overhead_fraction": 0.0,
      "area_with_dummy_um2": 2.34,
      "area_low_um2": 1.87,
      "area_high_um2": 3.15
    }
  ],
  "summary": {
    "device_count": 10,
    "mos_count": 9,
    "cap_count": 1,
    "group_count": 7,
    "width_convention": "per_finger",
    "area_core_um2": 1409.16,
    "area_active_um2": 1706.7,
    "area_matched_um2": 2247.21,
    "area_block_um2": 3376.65,
    "area_envelope_um2": 3646.78,
    "area_ring_um2": 104.99,
    "area_device_routing_um2": 192.55,
    "area_dummy_um2": 456.66,
    "dummy_area_um2": 456.66,
    "area_matching_overhead_um2": 83.85,
    "area_periphery_um2": 1129.44,
    "area_reserved_um2": 270.13,
    "area_parts_no_dummy_um2": 1706.7,
    "area_parts_with_dummy_um2": 2247.21,
    "area_block_no_dummy_um2": 2674.86,
    "area_block_with_dummy_um2": 3376.65,
    "area_core_fraction": 0.4173,
    "area_active_fraction": 0.5054,
    "area_matched_fraction": 0.6655,
    "area_block_fraction": 1.0,